industry,pain_point,slug
Termite Inspectors,checking wood and treatment plans,website-creation-for-termite-inspectors
Mold Remediators,testing air quality and remediation reports,website-creation-for-mold-remediators
Asbestos Abatement,gearing safety and removal logs,website-creation-for-asbestos-abatement
Radon Testers,monitoring levels and mitigation advice,website-creation-for-radon-testers
Home Inspectors,writing reports and defect noting,website-creation-for-home-inspectors
Building Contractors,filing permits and subcontractor coordination,website-creation-for-building-contractors
Demolition Crews,clearing sites and debris hauling,website-creation-for-demolition-crews
Excavation Services,permitting digs and backfill planning,website-creation-for-excavation-services
Foundation Layers,pouring concrete and rebar placement,website-creation-for-foundation-layers
Framing Carpenters,placing beams and blueprint reading,website-creation-for-framing-carpenters
Drywall Installers,hanging sheets and mudding joints,website-creation-for-drywall-installers
Insulation Experts,spraying foam and vapor barriers,website-creation-for-insulation-experts
Siding Contractors,matching colors and panel installation,website-creation-for-siding-contractors
Window Installers,fitting glass and seal caulking,website-creation-for-window-installers
Door Hangars,aligning locks and hinge adjustments,website-creation-for-door-hangars
Flooring Specialists,laying tiles and underlayment prep,website-creation-for-flooring-specialists
Carpet Layers,cutting rolls and seam sealing,website-creation-for-carpet-layers
Tile Setters,applying grout and pattern alignment,website-creation-for-tile-setters
Hardwood Refinishers,sanding dust and stain application,website-creation-for-hardwood-refinishers
Cabinet Makers,sliding drawers and hardware installation,website-creation-for-cabinet-makers
Countertop Fabricators,cutting stone and edge polishing,website-creation-for-countertop-fabricators
Appliance Installers,connecting wiring and level adjustments,website-creation-for-appliance-installers
HVAC Technicians,cleaning ducts and refrigerant charging,website-creation-for-hvac-technicians
Plumbing Contractors,soldering pipes and fixture installations,website-creation-for-plumbing-contractors
Electrical Contractors,wiring circuits and panel upgrades,website-creation-for-electrical-contractors
Security System Installers,testing alarms and camera placement,website-creation-for-security-system-installers
Smart Home Integrators,pairing devices and app setup,website-creation-for-smart-home-integrators
Solar Panel Installers,setting inverters and grid tying,website-creation-for-solar-panel-installers
Wind Turbine Technicians,balancing blades and tower climbs,website-creation-for-wind-turbine-technicians
Geothermal Specialists,drilling loops and heat pump installation,website-creation-for-geothermal-specialists
Rainwater Harvesters,installing tanks and filtration systems,website-creation-for-rainwater-harvesters
Septic System Engineers,maintaining pumps and drain field inspections,website-creation-for-septic-system-engineers
Well Drillers,testing water and pump installations,website-creation-for-well-drillers
Pool Builders,fitting liners and filter systems,website-creation-for-pool-builders
Hot Tub Installers,calibrating heaters and jet alignments,website-creation-for-hot-tub-installers
Fence Builders,digging posts and gate hardware,website-creation-for-fence-builders
Deck Constructors,installing rails and joist spacing,website-creation-for-deck-constructors
Patio Designers,laying pavers and drainage planning,website-creation-for-patio-designers
Outdoor Lighting,placing fixtures and wiring runs,website-creation-for-outdoor-lighting
Sprinkler System Installers,adjusting heads and zone mapping,website-creation-for-sprinkler-system-installers
Tree Trimmers,removing branches and stump grinding,website-creation-for-tree-trimmers
Stump Grinders,extracting roots and site cleanup,website-creation-for-stump-grinders
Snow Removal Services,routing plows and salt spreading,website-creation-for-snow-removal-services
Gutter Cleaners,clearing leaf debris and downspout checks,website-creation-for-gutter-cleaners
Chimney Sweeps,building up soot and flue inspections,website-creation-for-chimney-sweeps
Roof Inspectors,checking shingles and leak detection,website-creation-for-roof-inspectors
Siding Repair,replacing panels and weather sealing,website-creation-for-siding-repair
Masonry Workers,laying bricks and mortar mixing,website-creation-for-masonry-workers
Concrete Pourers,mixing ratios and form setting,website-creation-for-concrete-pourers
Asphalt Pavers,compacting rollers and base prep,website-creation-for-asphalt-pavers
Driveway Sealers,filling cracks and coat application,website-creation-for-driveway-sealers
Garage Door Installers,tensioning springs and opener programming,website-creation-for-garage-door-installers
Elevator Technicians,inspecting cables and control panels,website-creation-for-elevator-technicians
Escalator Maintenance,aligning steps and handrail syncing,website-creation-for-escalator-maintenance
Boiler Mechanics,replacing valves and pressure testing,website-creation-for-boiler-mechanics
Furnace Repair,changing filters and ignition checks,website-creation-for-furnace-repair
Air Conditioner Service,leveling Freon and coil cleaning,website-creation-for-air-conditioner-service
Refrigeration Techs,checking compressors and thermostat calibration,website-creation-for-refrigeration-techs
Vending Machine Operators,refilling stock and coin collection,website-creation-for-vending-machine-operators
ATM Servicers,loading cash and transaction logs,website-creation-for-atm-servicers
Coin Laundry Owners,cycling machines and detergent stock,website-creation-for-coin-laundry-owners
Dry Cleaners,tagging garments and stain treatment,website-creation-for-dry-cleaners
Tailor Shops,adjusting hems and button replacements,website-creation-for-tailor-shops
Shoe Repair,cobbling tools and sole gluing,website-creation-for-shoe-repair
Watch Repair,swapping batteries and band adjustments,website-creation-for-watch-repair
Jewelry Repair,fixing clasps and stone setting,website-creation-for-jewelry-repair
Bicycle Repair,lubing chains and tire inflation,website-creation-for-bicycle-repair
Motorcycle Mechanics,tuning engines and oil changes,website-creation-for-motorcycle-mechanics
Auto Body Shops,matching paints and dent pulling,website-creation-for-auto-body-shops
Tire Shops,balancing rotations and tread checks,website-creation-for-tire-shops
Oil Change Stations,replacing filters and fluid top-ups,website-creation-for-oil-change-stations
Car Wash Operators,dispensing soap and wax applications,website-creation-for-car-wash-operators
Detailing Services,buffing polish and interior vacuuming,website-creation-for-detailing-services
RV Repair,fixing awnings and plumbing leaks,website-creation-for-rv-repair
Boat Mechanics,patching hulls and engine overhauls,website-creation-for-boat-mechanics
Aircraft Maintenance,inspecting wings and avionics testing,website-creation-for-aircraft-maintenance
Train Mechanics,coupling rails and brake inspections,website-creation-for-train-mechanics
Bus Repair,padding brakes and exhaust checks,website-creation-for-bus-repair
Truck Mechanics,aligning axles and transmission fluids,website-creation-for-truck-mechanics
Heavy Equipment Operators,checking hydraulic leaks and blade sharpening,website-creation-for-heavy-equipment-operators
Crane Operators,capacity lifting and signal coordination,website-creation-for-crane-operators
Bulldozer Drivers,sharpening blades and site leveling,website-creation-for-bulldozer-drivers
Excavator Operators,replacing bucket teeth and dig depth,website-creation-for-excavator-operators
Forklift Mechanics,charging batteries and fork adjustments,website-creation-for-forklift-mechanics
Warehouse Forklifts,stacking pallets and aisle navigation,website-creation-for-warehouse-forklifts
Shipping Dock Workers,loading containers and manifest verification,website-creation-for-shipping-dock-workers
Port Crane Operators,slinging cargo and load balancing,website-creation-for-port-crane-operators
Fishery Processors,filleting fish and packing lines,website-creation-for-fishery-processors
Cannery Workers,applying labels and can sealing,website-creation-for-cannery-workers
Bakery Production,mixing dough and oven timing,website-creation-for-bakery-production
Food Processing,inspecting quality and line efficiency,website-creation-for-food-processing
Beverage Bottlers,filling lines and cap tightening,website-creation-for-beverage-bottlers
Pharma Packagers,counting pills and blister packing,website-creation-for-pharma-packagers
Textile Weavers,threading looms and pattern weaving,website-creation-for-textile-weavers
Garment Factories,stitching seams and quality checks,website-creation-for-garment-factories
Shoe Manufacturers,gluing soles and last shaping,website-creation-for-shoe-manufacturers
Leather Workers,tanning hides and cutting patterns,website-creation-for-leather-workers
Furniture Assembly,fastening joints and upholstery stapling,website-creation-for-furniture-assembly
Toy Manufacturers,molding parts and safety testing,website-creation-for-toy-manufacturers
Electronics Assembly,soldering circuits and board testing,website-creation-for-electronics-assembly
Appliance Manufacturers,running assembly lines and quality assurance,website-creation-for-appliance-manufacturers
Automotive Assembly,torquing bolts and paint booths,website-creation-for-automotive-assembly
Aerospace Manufacturing,setting rivets and wind tunnel tests,website-creation-for-aerospace-manufacturing
Shipbuilders,seaming welds and dry dock launches,website-creation-for-shipbuilders
Railcar Builders,attaching bogies and brake systems,website-creation-for-railcar-builders
Bicycle Manufacturers,welding frames and wheel truing,website-creation-for-bicycle-manufacturers
Sports Equipment Makers,inflating balls and material testing,website-creation-for-sports-equipment-makers
Musical Instrument Craftsmen,tuning strings and varnish application,website-creation-for-musical-instrument-craftsmen
Art Supply Manufacturers,mixing paints and brush bristle selection,website-creation-for-art-supply-manufacturers
Office Supply Distributors,shelving stock and order picking,website-creation-for-office-supply-distributors
Hardware Stores,inventorying tools and customer advice,website-creation-for-hardware-stores
Garden Centers,watering plants and seasonal displays,website-creation-for-garden-centers
Pet Supply Shops,bagging food and toy recommendations,website-creation-for-pet-supply-shops
Grocery Stores,stocking shelves and produce rotation,website-creation-for-grocery-stores
Supermarket Managers,rotating produce and inventory scans,website-creation-for-supermarket-managers
Convenience Stores,registering cash and stock replenishment,website-creation-for-convenience-stores
Pharmacies,filling prescriptions and insurance verification,website-creation-for-pharmacies
Health Food Stores,labeling supplements and nutrition advice,website-creation-for-health-food-stores
Liquor Stores,stocking bottles and age verification,website-creation-for-liquor-stores
Wine Shops,hosting tastings and cellar recommendations,website-creation-for-wine-shops
Beer Distributors,tapping kegs and delivery routes,website-creation-for-beer-distributors
Coffee Shops,grinding beans and latte art,website-creation-for-coffee-shops
Tea Houses,steeping leaves and blend creation,website-creation-for-tea-houses
Ice Cream Parlors,serving scoops and flavor rotations,website-creation-for-ice-cream-parlors
Candy Stores,wrapping sweets and bulk bin refills,website-creation-for-candy-stores
Chocolate Makers,tempering cacao and mold filling,website-creation-for-chocolate-makers
Popcorn Vendors,popping kernels and flavor tossing,website-creation-for-popcorn-vendors
Street Food Vendors,setting up carts and menu boards,website-creation-for-street-food-vendors
Food Truck Owners,boarding menus and location tracking,website-creation-for-food-truck-owners
Catering Services,setting up events and dietary accommodations,website-creation-for-catering-services
Banquet Halls,arranging tables and AV setups,website-creation-for-banquet-halls
Wedding Venues,hanging decor and vendor coordination,website-creation-for-wedding-venues
Conference Centers,testing AV and room configurations,website-creation-for-conference-centers
Hotels,cleaning rooms and front desk check-ins,website-creation-for-hotels
Motels,desking check-ins and room turnover,website-creation-for-motels
Bed and Breakfasts,prepping breakfasts and guest preferences,website-creation-for-bed-and-breakfasts
Hostels,assigning bunks and locker rentals,website-creation-for-hostels
Airbnbs,reviewing guests and cleaning schedules,website-creation-for-airbnbs
Vacation Rentals,handing off keys and maintenance requests,website-creation-for-vacation-rentals
Timeshare Managers,allocating weeks and owner communications,website-creation-for-timeshare-managers
Campgrounds,pitching tents and fire pit safety,website-creation-for-campgrounds
RV Parks,hooking up sites and utility metering,website-creation-for-rv-parks
Glamping Sites,setting luxury tents and amenity stocking,website-creation-for-glamping-sites
Eco Lodges,walking nature and sustainability education,website-creation-for-eco-lodges
Ski Lodges,passing lifts and gear rentals,website-creation-for-ski-lodges
Beach Resorts,renting cabanas and tide schedules,website-creation-for-beach-resorts
Mountain Cabins,stocking firewood and trail maps,website-creation-for-mountain-cabins
Lake Houses,docking boats and fishing permits,website-creation-for-lake-houses
Island Retreats,scheduling ferries and excursion bookings,website-creation-for-island-retreats
Safari Lodges,driving games and wildlife sightings,website-creation-for-safari-lodges
Jungle Camps,touring canopies and insect netting,website-creation-for-jungle-camps
Desert Oases,riding camels and star gazing,website-creation-for-desert-oases
Polar Expeditions,navigating icebreakers and gear checks,website-creation-for-polar-expeditions
Space Tourism,booking orbits and zero-g training,website-creation-for-space-tourism
Psychologists,experiment design,website-creation-for-psychologists-2
Virtual Reality Tours,headset calibration,website-creation-for-virtual-reality-tours
Augmented Reality Guides,overlay updates,website-creation-for-augmented-reality-guides
Metaverse Hosts,avatar customizations,website-creation-for-metaverse-hosts
NFT Galleries,token auctions,website-creation-for-nft-galleries
Crypto Exchanges,trade confirmations,website-creation-for-crypto-exchanges
Blockchain Consultants,ledger audits,website-creation-for-blockchain-consultants
Web3 Developers,dao governance,website-creation-for-web3-developers
DeFi Platforms,lending pools,website-creation-for-defi-platforms
GameFi Creators,token economies,website-creation-for-gamefi-creators
AI Ethics Advisors,bias checks,website-creation-for-ai-ethics-advisors
Machine Learning Engineers,data labeling,website-creation-for-machine-learning-engineers
Data Scientists,model validation,website-creation-for-data-scientists
Big Data Analysts,query optimization,website-creation-for-big-data-analysts
Cloud Computing Specialists,vm provisioning,website-creation-for-cloud-computing-specialists
IoT Developers,sensor integration,website-creation-for-iot-developers
Cyber Physical Systems,control loops,website-creation-for-cyber-physical-systems
Quantum Computing Researchers,qubit stabilization,website-creation-for-quantum-computing-researchers
Nanotechnology Labs,molecule assembly,website-creation-for-nanotechnology-labs
Biotechnology Startups,gene editing,website-creation-for-biotechnology-startups
Synthetic Biology,organism design,website-creation-for-synthetic-biology
Neuroscience Labs,brain mapping,website-creation-for-neuroscience-labs
Cognitive Science,perception tests,website-creation-for-cognitive-science
Behavioral Economics,experiment runs,website-creation-for-behavioral-economics
Game Theory Analysts,strategy simulations,website-creation-for-game-theory-analysts
Operations Research,optimization models,website-creation-for-operations-research
Supply Chain Analytics,demand forecasting,website-creation-for-supply-chain-analytics
Logistics Optimization,route algorithms,website-creation-for-logistics-optimization
Inventory Optimization,safety stock,website-creation-for-inventory-optimization
Quality Assurance,defect rates,website-creation-for-quality-assurance
Lean Manufacturing,waste reduction,website-creation-for-lean-manufacturing
Six Sigma Black Belts,process variance,website-creation-for-six-sigma-black-belts
Project Management Offices,milestone tracking,website-creation-for-project-management-offices
Agile Coaches,sprint planning,website-creation-for-agile-coaches
Scrum Masters,backlog grooming,website-creation-for-scrum-masters
Kanban Teams,board updates,website-creation-for-kanban-teams
Business Analysts,requirement gathering,website-creation-for-business-analysts
Change Management,transition plans,website-creation-for-change-management
Risk Management,threat assessment,website-creation-for-risk-management
Compliance Officers,audit trails,website-creation-for-compliance-officers
Internal Auditors,control testing,website-creation-for-internal-auditors
Forensic Accountants,fraud detection,website-creation-for-forensic-accountants
Treasury Managers,cash flow,website-creation-for-treasury-managers
Investment Managers,asset allocation,website-creation-for-investment-managers
Hedge Fund Traders,position sizing,website-creation-for-hedge-fund-traders
Venture Capitalists,deal sourcing,website-creation-for-venture-capitalists
Private Equity Firms,portfolio companies,website-creation-for-private-equity-firms
Angel Investors,startup pitches,website-creation-for-angel-investors
Crowdfunding Platforms,campaign monitoring,website-creation-for-crowdfunding-platforms
Fintech Startups,payment gateways,website-creation-for-fintech-startups
Insurtech Companies,policy quoting,website-creation-for-insurtech-companies
Regtech Solutions,reporting automation,website-creation-for-regtech-solutions
Healthtech Ventures,patient portals,website-creation-for-healthtech-ventures
Edtech Providers,learning modules,website-creation-for-edtech-providers
Agritech Farmers,precision farming,website-creation-for-agritech-farmers
Cleantech Engineers,energy efficiency,website-creation-for-cleantech-engineers
Spacetech Companies,satellite launches,website-creation-for-spacetech-companies
Robotech Developers,autonomous navigation,website-creation-for-robotech-developers
Dronetech Operators,flight logging,website-creation-for-dronetech-operators
Autonomous Vehicle Makers,sensor fusion,website-creation-for-autonomous-vehicle-makers
Electric Mobility,charging stations,website-creation-for-electric-mobility
Smart City Planners,iot integration,website-creation-for-smart-city-planners
Digital Twins,model synchronization,website-creation-for-digital-twins
3D Printing Services,filament stock,website-creation-for-3d-printing-services
Additive Manufacturing,layer deposition,website-creation-for-additive-manufacturing
CNC Machinists,tool paths,website-creation-for-cnc-machinists
Laser Cutting,beam focusing,website-creation-for-laser-cutting
Welding Shops,arc striking,website-creation-for-welding-shops
Metal Fabricators,sheet bending,website-creation-for-metal-fabricators
Plastic Molders,injection cycles,website-creation-for-plastic-molders
Glass Blowers,furnace heating,website-creation-for-glass-blowers
Ceramics Potters,kiln firing,website-creation-for-ceramics-potters
Sculptors,chisel carving,website-creation-for-sculptors
Printmakers,ink rolling,website-creation-for-printmakers
Lithographers,plate etching,website-creation-for-lithographers
Screen Printers,mesh tension,website-creation-for-screen-printers
Digital Printers,inkjet calibration,website-creation-for-digital-printers
Sign Makers,vinyl cutting,website-creation-for-sign-makers
Billboard Installers,frame mounting,website-creation-for-billboard-installers
Neon Sign Creators,tube bending,website-creation-for-neon-sign-creators
LED Display Techs,pixel mapping,website-creation-for-led-display-techs
Projection Mapping,content warping,website-creation-for-projection-mapping
Hologram Designers,laser interference,website-creation-for-hologram-designers
Interactive Installations,sensor triggers,website-creation-for-interactive-installations
Museum Exhibit Designers,artifact display,website-creation-for-museum-exhibit-designers
Theme Park Designers,ride concepts,website-creation-for-theme-park-designers
Set Designers,prop placement,website-creation-for-set-designers
Costume Makers,fabric cutting,website-creation-for-costume-makers
Prop Masters,inventory catalog,website-creation-for-prop-masters
Special Effects Techs,pyro ignition,website-creation-for-special-effects-techs
Stunt Coordinators,safety harnesses,website-creation-for-stunt-coordinators
Casting Directors,actor headshots,website-creation-for-casting-directors
Talent Agents,contract signing,website-creation-for-talent-agents
Model Agencies,runway bookings,website-creation-for-model-agencies
Voice Actors,script reading,website-creation-for-voice-actors
Dubbing Studios,-sync matching,website-creation-for-dubbing-studios
Subtitlers,text timing,website-creation-for-subtitlers
Translators,language pairs,website-creation-for-translators
Interpreters,conference booths,website-creation-for-interpreters
Sign Language Interpreters,hand gestures,website-creation-for-sign-language-interpreters
Braille Transcribers,page embossing,website-creation-for-braille-transcribers
Audio Describers,scene narration,website-creation-for-audio-describers
Accessibility Consultants,compliance checks,website-creation-for-accessibility-consultants
UX Researchers,user testing,website-creation-for-ux-researchers
A/B Testers,variant analysis,website-creation-for-a-b-testers
Conversion Optimizers,funnel tracking,website-creation-for-conversion-optimizers
SEO Auditors,keyword audits,website-creation-for-seo-auditors
PPC Managers,bid adjustments,website-creation-for-ppc-managers
Social Media Managers,post scheduling,website-creation-for-social-media-managers
Email Marketers,list segmentation,website-creation-for-email-marketers
Content Strategists,editorial calendars,website-creation-for-content-strategists
Copywriters,headline brainstorming,website-creation-for-copywriters
Ghostwriters,manuscript drafting,website-creation-for-ghostwriters
Technical Writers,manual updates,website-creation-for-technical-writers
Grant Writers,proposal submissions,website-creation-for-grant-writers
Resume Writers,format templates,website-creation-for-resume-writers
Speech Writers,delivery notes,website-creation-for-speech-writers
Script Writers,scene outlining,website-creation-for-script-writers
Novelists,chapter revisions,website-creation-for-novelists
Poets,verse composition,website-creation-for-poets
Lyricists,melody matching,website-creation-for-lyricists
Composers,score notation,website-creation-for-composers
Arrangers,instrument parts,website-creation-for-arrangers
Music Producers,track mixing,website-creation-for-music-producers
Sound Designers,effect libraries,website-creation-for-sound-designers
Foley Artists,noise creation,website-creation-for-foley-artists
Radio Hosts,segment planning,website-creation-for-radio-hosts
Podcast Producers,guest booking,website-creation-for-podcast-producers
TV Producers,episode budgeting,website-creation-for-tv-producers
Film Producers,funding rounds,website-creation-for-film-producers
Documentary Makers,interview scheduling,website-creation-for-documentary-makers
News Anchors,teleprompter reading,website-creation-for-news-anchors
Weather Reporters,forecast graphics,website-creation-for-weather-reporters
Sports Commentators,play-by-play,website-creation-for-sports-commentators
Talk Show Hosts,topic research,website-creation-for-talk-show-hosts
Reality TV Directors,challenge setup,website-creation-for-reality-tv-directors
Game Show Producers,prize distribution,website-creation-for-game-show-producers
Quiz Masters,question banks,website-creation-for-quiz-masters
Trivia Night Hosts,score keeping,website-creation-for-trivia-night-hosts
Karaoke DJs,song queues,website-creation-for-karaoke-djs
Wedding DJs,playlist requests,website-creation-for-wedding-djs
Club DJs,beat matching,website-creation-for-club-djs
Rave Organizers,light shows,website-creation-for-rave-organizers
Festival Planners,stage lineups,website-creation-for-festival-planners
Concert Promoters,ticket presales,website-creation-for-concert-promoters
Tour Managers,venue bookings,website-creation-for-tour-managers
Roadies,gear load-in,website-creation-for-roadies
Merch Sellers,stock counts,website-creation-for-merch-sellers
Fan Club Managers,member perks,website-creation-for-fan-club-managers
Autograph Sessions,photo ops,website-creation-for-autograph-sessions
Celebrity Managers,appearance fees,website-creation-for-celebrity-managers
Publicists,press releases,website-creation-for-publicists
Brand Ambassadors,product demos,website-creation-for-brand-ambassadors
Influencer Managers,collab negotiations,website-creation-for-influencer-managers
Vloggers,video editing,website-creation-for-vloggers
Streamers,chat moderation,website-creation-for-streamers
TikTok Creators,dance challenges,website-creation-for-tiktok-creators
Instagram Influencers,story polls,website-creation-for-instagram-influencers
YouTube Channels,subscriber growth,website-creation-for-youtube-channels
Twitch Streamers,donation alerts,website-creation-for-twitch-streamers
OnlyFans Creators,content uploads,website-creation-for-onlyfans-creators
Patreon Artists,reward tiers,website-creation-for-patreon-artists
Kickstarter Campaigners,backer updates,website-creation-for-kickstarter-campaigners
