industry,pain_point,slug
Emergency Plumbers,managing dispatch logistics and on-site invoicing,website-creation-for-emergency-plumbers
Wedding Photographers,tracking client deposits and gallery deadlines,website-creation-for-wedding-photographers
Freelance Graphic Designers,handling scope creep and chasing unpaid invoices,website-creation-for-freelance-designers
Crossfit Gym Owners,automating member renewals and class check-ins,website-creation-for-crossfit-gyms
Independent Aestheticians,reducing no-show appointments and inventory waste,website-creation-for-aestheticians
HVAC Technicians,scheduling seasonal maintenance and fleet tracking,website-creation-for-hvac-technicians
Dentists,coordinating patient appointments and follow-up reminders,website-creation-for-dentists
Plumbers,monitoring service calls and inventory for parts,website-creation-for-plumbers
Lawyers,tracking billable hours and client case updates,website-creation-for-lawyers
Freelancers,managing project timelines and payment reminders,website-creation-for-freelancers
Real Estate Agents,handling lead follow-ups and property showings,website-creation-for-real-estate-agents
Insurance Agents,managing policy renewals and client claims processing,website-creation-for-insurance-agents
Contractors,coordinating job scheduling and subcontractor assignments,website-creation-for-contractors
Electricians,dispatching technicians and tracking job completions,website-creation-for-electricians
HVAC Companies,managing service contracts and preventive maintenance schedules,website-creation-for-hvac
Accountants,tracking time spent on tasks and client financial reporting,website-creation-for-accountants
Veterinarians,maintaining pet health records and appointment reminders,website-creation-for-veterinarians
Beauty Salons,reducing appointment no-shows and managing client preferences,website-creation-for-beauty-salons
Hair Salons,tracking client hair care histories and product recommendations,website-creation-for-hair-salons
Barbers,managing repeat bookings and customer loyalty programs,website-creation-for-barbers
Nail Salons,monitoring product inventory and client appointment histories,website-creation-for-nail-salons
Massage Therapists,scheduling sessions and tracking client treatment notes,website-creation-for-massage-therapists
Chiropractors,managing patient treatment plans and progress tracking,website-creation-for-chiropractors
Physical Therapists,monitoring patient progress and exercise regimens,website-creation-for-physical-therapists
Optometrists,handling prescription management and eye exam follow-ups,website-creation-for-optometrists
Auto Repair Shops,tracking vehicle service histories and part orders,website-creation-for-auto-repair
Car Dealerships,managing customer follow-ups and sales leads,website-creation-for-car-dealerships
Landscapers,optimizing crew routing and seasonal maintenance schedules,website-creation-for-landscapers
Cleaning Services,handling recurring schedules and client feedback,website-creation-for-cleaning-services
Pest Control,tracking service histories and treatment effectiveness,website-creation-for-pest-control
Roofers,managing warranty tracking and repair quotes,website-creation-for-roofers
Painters,handling quote follow-ups and project material estimates,website-creation-for-painters
Photographers,managing client proofing and session bookings,website-creation-for-photographers
Wedding Planners,coordinating vendors and timeline management,website-creation-for-wedding-planners
Event Planners,tracking guest lists and RSVP responses,website-creation-for-event-planners
Fitness Centers,managing membership renewals and attendance tracking,website-creation-for-fitness-centers
Gyms,handling class bookings and member progress logs,website-creation-for-gyms
Personal Trainers,tracking client progress and workout plans,website-creation-for-personal-trainers
Yoga Studios,managing class attendance and instructor schedules,website-creation-for-yoga-studios
Restaurants,optimizing reservation management and table turnover,website-creation-for-restaurants
Cafes,building customer loyalty and order histories,website-creation-for-cafes
Travel Agencies,managing itineraries and client preferences,website-creation-for-travel-agencies
Financial Advisors,tracking client portfolios and investment updates,website-creation-for-financial-advisors
Consultants,handling proposal tracking and client deliverables,website-creation-for-consultants
Marketing Agencies,monitoring campaign reporting and ROI metrics,website-creation-for-marketing-agencies
Graphic Designers,managing revision feedback and project approvals,website-creation-for-graphic-designers
Interior Designers,tracking project timelines and supplier orders,website-creation-for-interior-designers
Architects,handling client approvals and blueprint revisions,website-creation-for-architects
Construction Companies,managing bid processes and subcontractor payments,website-creation-for-construction
Nonprofits,tracking donor management and fundraising campaigns,website-creation-for-nonprofits
Tutors,scheduling lessons and tracking student progress,website-creation-for-tutors
Coaches,monitoring goal tracking and client achievements,website-creation-for-coaches
Therapists,managing session notes and treatment plans,website-creation-for-therapists
Daycares,facilitating parent communication and child activity logs,website-creation-for-daycares
E-commerce Stores,recovering abandoned carts and customer retargeting,website-creation-for-ecommerce
Retail Stores,managing customer loyalty programs and purchase histories,website-creation-for-retail
Property Managers,handling tenant requests and maintenance tickets,website-creation-for-property-managers
Home Builders,tracking client selections and construction milestones,website-creation-for-home-builders
Pool Services,scheduling maintenance and chemical inventory tracking,website-creation-for-pool-services
Tree Services,managing seasonal work and equipment maintenance,website-creation-for-tree-services
Window Cleaners,optimizing routes and recurring client schedules,website-creation-for-window-cleaners
Locksmiths,dispatching emergency calls and key inventory management,website-creation-for-locksmiths
Towing Companies,tracking vehicle locations and service requests,website-creation-for-towing
Software Developers,managing bug tracking and version releases,website-creation-for-software-developers
Teachers,tracking student progress and assignment submissions,website-creation-for-teachers
Doctors,scheduling patient appointments and medical records access,website-creation-for-doctors
Nurses,coordinating shift schedules and patient care notes,website-creation-for-nurses
Pharmacists,managing inventory and prescription refills,website-creation-for-pharmacists
Real Estate Developers,tracking project timelines and investor updates,website-creation-for-real-estate-developers
Hotel Managers,handling room bookings and guest check-ins,website-creation-for-hotel-managers
Tour Guides,coordinating itineraries and group logistics,website-creation-for-tour-guides
Chefs,managing supplier orders and menu planning,website-creation-for-chefs
Bakers,tracking order fulfillment and ingredient stocks,website-creation-for-bakers
Farmers,planning crop rotations and harvest schedules,website-creation-for-farmers
Fishermen,logging catches and equipment maintenance,website-creation-for-fishermen
Miners,tracking equipment maintenance and safety logs,website-creation-for-miners
Manufacturers,optimizing supply chain tracking and production runs,website-creation-for-manufacturers
Warehouse Managers,monitoring inventory levels and order picking,website-creation-for-warehouse-managers
Logistics Companies,optimizing shipment routing and delivery timelines,website-creation-for-logistics
Shipping Companies,managing cargo manifests and port coordination,website-creation-for-shipping
Airlines,assigning flight crews and passenger manifests,website-creation-for-airlines
Pilots,logging flights and maintenance checks,website-creation-for-pilots
Train Conductors,ensuring schedule adherence and passenger safety,website-creation-for-train-conductors
Bus Drivers,optimizing routes and passenger boarding,website-creation-for-bus-drivers
Taxi Services,improving dispatch efficiency and driver assignments,website-creation-for-taxi-services
Ride-Sharing Companies,tracking driver ratings and ride requests,website-creation-for-ride-sharing
Courier Services,monitoring package delivery tracking and proofs of delivery,website-creation-for-courier-services
Journalists,managing sources and article deadlines,website-creation-for-journalists
Editors,tracking content deadlines and revisions,website-creation-for-editors
Publishers,handling author royalties and book launches,website-creation-for-publishers
Authors,managing manuscript revisions and editor feedback,website-creation-for-authors
Librarians,tracking book checkouts and overdue reminders,website-creation-for-librarians
Museum Curators,scheduling exhibits and artifact maintenance,website-creation-for-museum-curators
Artists,tracking commissions and gallery submissions,website-creation-for-artists
Musicians,booking gigs and fan engagement,website-creation-for-musicians
Actors,following up on auditions and role preparations,website-creation-for-actors
Directors,coordinating casts and production schedules,website-creation-for-directors
Producers,overseeing budgets and funding sources,website-creation-for-producers
Theater Managers,managing ticket sales and seating arrangements,website-creation-for-theater-managers
Cinema Operators,scheduling screenings and concession inventory,website-creation-for-cinema-operators
Sports Coaches,tracking player stats and training sessions,website-creation-for-sports-coaches
Athletes,logging training and performance metrics,website-creation-for-athletes
Gym Instructors,managing class rosters and member feedback,website-creation-for-gym-instructors
Nutritionists,tracking client diets and progress reports,website-creation-for-nutritionists
Dietitians,planning meals and monitoring health outcomes,website-creation-for-dietitians
Psychologists,scheduling therapy sessions and note-taking,website-creation-for-psychologists
Counselors,managing client notes and follow-up plans,website-creation-for-counselors
Social Workers,handling case management and resource referrals,website-creation-for-social-workers
HR Managers,streamlining employee onboarding and performance reviews,website-creation-for-hr-managers
Recruiters,sourcing candidates and tracking applications,website-creation-for-recruiters
Sales Teams,qualifying leads and pipeline management,website-creation-for-sales-teams
Customer Support,resolving issues and ticketing systems,website-creation-for-customer-support
IT Support,managing helpdesk tickets and resolution times,website-creation-for-it-support
Engineers,tracking project milestones and team collaborations,website-creation-for-engineers
Scientists,logging research data and experiment results,website-creation-for-scientists
Researchers,applying for grants and tracking funding,website-creation-for-researchers
Professors,grading students and course planning,website-creation-for-professors
School Administrators,managing enrollments and parent communications,website-creation-for-school-administrators
University Deans,evaluating faculty and program oversight,website-creation-for-university-deans
Bankers,approving loans and client relationship management,website-creation-for-bankers
Investment Brokers,updating portfolios and market alerts,website-creation-for-investment-brokers
Stock Traders,monitoring market alerts and trade executions,website-creation-for-stock-traders
Account Managers,ensuring client retention and upselling opportunities,website-creation-for-account-managers
Advertising Agencies,tracking ad campaign metrics and client ROI,website-creation-for-advertising-agencies
PR Firms,managing media contacts and press releases,website-creation-for-pr-firms
Bloggers,engaging subscribers and content scheduling,website-creation-for-bloggers
Influencers,negotiating sponsorship deals and audience analytics,website-creation-for-influencers
Podcasters,scheduling episodes and guest coordination,website-creation-for-podcasters
Video Creators,handling viewer feedback and content uploads,website-creation-for-video-creators
App Developers,managing beta testing and user feedback loops,website-creation-for-app-developers
Game Developers,tracking player feedback and update releases,website-creation-for-game-developers
Web Designers,handling client revisions and site launches,website-creation-for-web-designers
SEO Specialists,monitoring keyword tracking and site performance,website-creation-for-seo-specialists
Content Creators,analyzing audience analytics and post scheduling,website-creation-for-content-creators
E-learning Platforms,managing course enrollments and student progress,website-creation-for-e-learning
Online Tutors,scheduling virtual sessions and lesson materials,website-creation-for-online-tutors
Language Schools,tracking student proficiency and class assignments,website-creation-for-language-schools
Music Teachers,planning lessons and student performance reviews,website-creation-for-music-teachers
Dance Instructors,choreographing routines and class registrations,website-creation-for-dance-instructors
Art Teachers,ordering supplies and student project tracking,website-creation-for-art-teachers
Pet Groomers,sending appointment reminders and client pet profiles,website-creation-for-pet-groomers
Dog Trainers,logging behavior and training progress,website-creation-for-dog-trainers
Veterinary Clinics,scheduling vaccinations and pet health alerts,website-creation-for-veterinary-clinics
Animal Shelters,processing adoptions and donor contributions,website-creation-for-animal-shelters
Zoos,tracking animal care records and visitor education programs,website-creation-for-zoos
Aquariums,maintaining exhibit maintenance and feeding schedules,website-creation-for-aquariums
Botanical Gardens,inventorying plants and event planning,website-creation-for-botanical-gardens
Park Rangers,logging visitors and maintenance issues,website-creation-for-park-rangers
Environmental Consultants,assessing impacts and regulatory compliance,website-creation-for-environmental-consultants
Sustainability Experts,tracking carbon footprints and green initiatives,website-creation-for-sustainability-experts
Energy Companies,monitoring usage and billing cycles,website-creation-for-energy-companies
Utility Providers,reporting outages and service restorations,website-creation-for-utility-providers
Water Treatment Plants,testing quality and compliance reporting,website-creation-for-water-treatment
Waste Management,optimizing collection routes and recycling metrics,website-creation-for-waste-management
Recycling Centers,sorting materials and tracking volumes,website-creation-for-recycling-centers
Funeral Homes,arranging services and family follow-ups,website-creation-for-funeral-homes
Cemeteries,managing plots and memorial services,website-creation-for-cemeteries
Florists,coordinating deliveries and seasonal orders,website-creation-for-florists
Caterers,planning menus and event logistics,website-creation-for-caterers
Party Planners,coordinating themes and vendor bookings,website-creation-for-party-planners
Conference Organizers,lining up speakers and attendee registrations,website-creation-for-conference-organizers
Trade Show Exhibitors,assigning booths and lead captures,website-creation-for-trade-show-exhibitors
Charity Organizations,planning fundraiser events and donor thank-yous,website-creation-for-charity-organizations
Volunteer Coordinators,assigning shifts and tracking hours,website-creation-for-volunteer-coordinators
Religious Leaders,outreaching to congregations and event planning,website-creation-for-religious-leaders
Community Centers,registering programs and facility bookings,website-creation-for-community-centers
Youth Groups,planning activities and parent communications,website-creation-for-youth-groups
Senior Care Facilities,scheduling resident activities and health checks,website-creation-for-senior-care
Home Health Aides,managing care schedules and patient reports,website-creation-for-home-health-aides
Hospice Care,planning patient comfort and family support,website-creation-for-hospice-care
Medical Researchers,tracking clinical trials and data analysis,website-creation-for-medical-researchers
Pharmaceutical Companies,developing drugs and regulatory submissions,website-creation-for-pharmaceutical-companies
Biotech Firms,conducting lab experiments and patent filings,website-creation-for-biotech-firms
Nanotech Engineers,testing prototypes and material sourcing,website-creation-for-nanotech-engineers
Aerospace Companies,scheduling launches and component testing,website-creation-for-aerospace
Automotive Manufacturers,sourcing parts and assembly line efficiency,website-creation-for-automotive-manufacturers
Electric Vehicle Makers,managing battery supplies and charging infrastructure,website-creation-for-electric-vehicle-makers
Bicycle Shops,logging repairs and customer bike profiles,website-creation-for-bicycle-shops
Motorcycle Dealers,customizing builds and warranty tracking,website-creation-for-motorcycle-dealers
Boat Builders,inspecting hulls and material orders,website-creation-for-boat-builders
Yacht Clubs,planning member events and dock assignments,website-creation-for-yacht-clubs
Sailing Instructors,booking lessons and weather checks,website-creation-for-sailing-instructors
Diving Centers,renting gear and certification tracking,website-creation-for-diving-centers
Surf Shops,inventorying boards and lesson bookings,website-creation-for-surf-shops
Ski Resorts,selling lift tickets and equipment rentals,website-creation-for-ski-resorts
Golf Courses,reserving tee times and course maintenance,website-creation-for-golf-courses
Tennis Clubs,booking courts and tournament planning,website-creation-for-tennis-clubs
Soccer Teams,managing player rosters and match schedules,website-creation-for-soccer-teams
Basketball Coaches,planning game strategies and player stats,website-creation-for-basketball-coaches
Baseball Managers,scouting reports and team practices,website-creation-for-baseball-managers
Fitness Influencers,sharing workout plans and follower engagement,website-creation-for-fitness-influencers
Wellness Coaches,tracking habits and client motivation,website-creation-for-wellness-coaches
Meditation Apps,monitoring user sessions and progress streaks,website-creation-for-meditation-apps
Spa Owners,booking treatments and product sales,website-creation-for-spa-owners
Aromatherapists,blending oils and client allergy notes,website-creation-for-aromatherapists
Acupuncturists,inventorying needles and treatment histories,website-creation-for-acupuncturists
Herbalists,formulating remedies and supplier orders,website-creation-for-herbalists
Naturopaths,planning holistic treatments and follow-ups,website-creation-for-naturopaths
Osteopaths,recording adjustments and patient feedback,website-creation-for-osteopaths
Podiatrists,noting foot care and orthotic fittings,website-creation-for-podiatrists
Dermatologists,planning skin treatments and biopsy tracking,website-creation-for-dermatologists
Oncologists,tracking cancer therapies and remission checks,website-creation-for-oncologists
Cardiologists,monitoring heart data and stress tests,website-creation-for-cardiologists
Neurologists,reviewing brain scans and seizure logs,website-creation-for-neurologists
Pediatricians,charting child growth and vaccination schedules,website-creation-for-pediatricians
Geriatricians,planning elderly care and mobility assessments,website-creation-for-geriatricians
Surgeons,scheduling operations and post-op follow-ups,website-creation-for-surgeons
Anesthesiologists,calculating dosages and patient monitoring,website-creation-for-anesthesiologists
Radiologists,reporting on imaging and diagnostic notes,website-creation-for-radiologists
Pathologists,analyzing lab results and tissue samples,website-creation-for-pathologists
Immunologists,tracking vaccines and allergy tests,website-creation-for-immunologists
Endocrinologists,monitoring hormone levels and thyroid checks,website-creation-for-endocrinologists
Gastroenterologists,logging digestive health and endoscopy results,website-creation-for-gastroenterologists
Urologists,testing kidney functions and prostate exams,website-creation-for-urologists
Gynecologists,scheduling women's health exams and pap smears,website-creation-for-gynecologists
Obstetricians,tracking prenatal visits and ultrasound results,website-creation-for-obstetricians
Orthodontists,adjusting braces and bite alignments,website-creation-for-orthodontists
Periodontists,treating gum diseases and deep cleanings,website-creation-for-periodontists
Endodontists,performing root canals and pain management,website-creation-for-endodontists
Prosthodontists,fitting dentures and crown placements,website-creation-for-prosthodontists
Oral Surgeons,realigning jaws and extraction planning,website-creation-for-oral-surgeons
Cosmetic Dentists,designing smile makeovers and whitening sessions,website-creation-for-cosmetic-dentists
Veterinary Surgeons,planning animal operations and recovery care,website-creation-for-veterinary-surgeons
Equine Vets,checking horse health and hoof care,website-creation-for-equine-vets
Avian Specialists,planning bird care and wing clippings,website-creation-for-avian-specialists
Reptile Handlers,maintaining enclosures and feeding schedules,website-creation-for-reptile-handlers
Wildlife Biologists,tracking species and habitat surveys,website-creation-for-wildlife-biologists
Marine Biologists,conducting ocean surveys and sample collections,website-creation-for-marine-biologists
Foresters,scheduling tree plantings and forest health checks,website-creation-for-foresters
Arborists,planning pruning jobs and tree risk assessments,website-creation-for-arborists
Horticulturists,breeding plants and greenhouse management,website-creation-for-horticulturists
Agronomists,testing soils and crop yield optimizations,website-creation-for-agronomists
Viticulturists,managing vineyards and grape harvests,website-creation-for-viticulturists
Winemakers,tracking fermentations and barrel aging,website-creation-for-winemakers
Brewers,batching recipes and quality tastings,website-creation-for-brewers
Distillers,aging spirits and distillation runs,website-creation-for-distillers
Baristas,sourcing coffee beans and brew recipes,website-creation-for-baristas
Sommeliers,pairing wines and cellar inventory,website-creation-for-sommeliers
Mixologists,innovating cocktails and bar stock management,website-creation-for-mixologists
Food Critics,submitting reviews and reservation tracking,website-creation-for-food-critics
Travel Bloggers,guiding destinations and affiliate links,website-creation-for-travel-bloggers
Adventure Guides,checking tour safety and equipment rentals,website-creation-for-adventure-guides
Cruise Directors,planning onboard activities and passenger feedback,website-creation-for-cruise-directors
Flight Attendants,serving passengers and safety briefings,website-creation-for-flight-attendants
Hotel Concierges,handling guest requests and local recommendations,website-creation-for-hotel-concierges
Resort Managers,booking amenities and staff coordination,website-creation-for-resort-managers
Campground Owners,reserving sites and facility maintenance,website-creation-for-campground-owners
RV Dealers,customizing vehicles and financing options,website-creation-for-rv-dealers
Car Rental Agencies,maintaining fleets and rental agreements,website-creation-for-car-rental-agencies
Bicycle Rental Shops,checking gears and customer rentals,website-creation-for-bicycle-rental-shops
Scooter Services,swapping batteries and user tracking,website-creation-for-scooter-services
Drone Operators,obtaining flight permissions and mission logs,website-creation-for-drone-operators
Robotics Engineers,debugging prototypes and component testing,website-creation-for-robotics-engineers
AI Specialists,training models and data preprocessing,website-creation-for-ai-specialists
Data Analysts,generating reports and visualization dashboards,website-creation-for-data-analysts
Cybersecurity Experts,monitoring threats and incident responses,website-creation-for-cybersecurity-experts
Network Administrators,ensuring system uptime and bandwidth allocation,website-creation-for-network-administrators
Cloud Architects,scaling infrastructure and migration planning,website-creation-for-cloud-architects
DevOps Teams,managing deployment pipelines and CI/CD workflows,website-creation-for-devops-teams
QA Testers,reporting bugs and test case automation,website-creation-for-qa-testers
Product Managers,roadmapping features and stakeholder alignment,website-creation-for-product-managers
UX Designers,looping user feedback and wireframe iterations,website-creation-for-ux-designers
UI Developers,prototyping interfaces and responsiveness testing,website-creation-for-ui-developers
Blockchain Developers,auditing smart contracts and chain integrations,website-creation-for-blockchain-developers
Crypto Traders,balancing portfolios and market volatility alerts,website-creation-for-crypto-traders
NFT Creators,launching collections and royalty distributions,website-creation-for-nft-creators
Metaverse Builders,managing virtual assets and user avatars,website-creation-for-metaverse-builders
VR Developers,testing experiences and hardware compatibility,website-creation-for-vr-developers
AR Specialists,integrating overlays and marker recognition,website-creation-for-ar-specialists
Gaming Streamers,interacting with viewers and stream schedules,website-creation-for-gaming-streamers
Esports Teams,preparing for tournaments and sponsor deals,website-creation-for-esports-teams
