industry,pain_point,slug
Comic Artists,sketching panels and storyboarding arcs,website-creation-for-comic-artists
Animators,rendering frames and motion tweening,website-creation-for-animators
Film Editors,sequencing cuts and color grading,website-creation-for-film-editors
Sound Engineers,mixing audio and effect layering,website-creation-for-sound-engineers
Lighting Technicians,diagramming setups and gel applications,website-creation-for-lighting-technicians
Stage Managers,inventorying props and cue calling,website-creation-for-stage-managers
Costume Designers,sourcing fabrics and fitting sessions,website-creation-for-costume-designers
Makeup Artists,stocking products and transformation planning,website-creation-for-makeup-artists
Tattoo Artists,consulting designs and aftercare instructions,website-creation-for-tattoo-artists
Piercers,inventorying jewelry and sterilization logs,website-creation-for-piercers
Fashion Designers,planning collection runways and trend analysis,website-creation-for-fashion-designers
Tailors,requesting alterations and measurement taking,website-creation-for-tailors
Jewelry Makers,sourcing gems and custom orders,website-creation-for-jewelry-makers
Watchmakers,logging repairs and part replacements,website-creation-for-watchmakers
Antique Dealers,scheduling appraisals and auction prep,website-creation-for-antique-dealers
Auction Houses,tracking bids and cataloging items,website-creation-for-auction-houses
Art Galleries,opening exhibitions and collector outreach,website-creation-for-art-galleries
Bookstores,restocking inventory and reading events,website-creation-for-bookstores
Toy Stores,recalling products and holiday stocking,website-creation-for-toy-stores
Electronics Retailers,claiming warranties and demo setups,website-creation-for-electronics-retailers
Appliance Stores,scheduling deliveries and installation coordination,website-creation-for-appliance-stores
Furniture Makers,ordering custom pieces and material estimates,website-creation-for-furniture-makers
Interior Decorators,approving color schemes and client mood boards,website-creation-for-interior-decorators
Home Stagers,listing properties and furniture rentals,website-creation-for-home-stagers
Mortgage Brokers,processing loan applications and rate locks,website-creation-for-mortgage-brokers
Title Companies,handling closing documents and escrow accounts,website-creation-for-title-companies
Appraisers,assessing values and market comparisons,website-creation-for-appraisers
Surveyors,measuring lands and boundary disputes,website-creation-for-surveyors
Civil Engineers,inspecting bridges and structural analyses,website-creation-for-civil-engineers
Mechanical Engineers,designing parts and simulation testing,website-creation-for-mechanical-engineers
Electrical Engineers,testing circuits and power distribution,website-creation-for-electrical-engineers
Chemical Engineers,optimizing formulas and process flows,website-creation-for-chemical-engineers
Industrial Designers,feedback on prototypes and user testing,website-creation-for-industrial-designers
Packaging Specialists,testing materials and design compliance,website-creation-for-packaging-specialists
Quality Control,logging defects and audit trails,website-creation-for-quality-control
Supply Chain Managers,negotiating with vendors and logistics coordination,website-creation-for-supply-chain-managers
Procurement Officers,issuing purchase orders and supplier evaluations,website-creation-for-procurement-officers
Inventory Clerks,auditing stocks and reorder alerts,website-creation-for-inventory-clerks
Forklift Operators,manifesting loads and safety checks,website-creation-for-forklift-operators
Truck Drivers,tracking mileage and load deliveries,website-creation-for-truck-drivers
Delivery Drivers,logging routes and proof of deliveries,website-creation-for-delivery-drivers
Postal Workers,sorting mail and route optimization,website-creation-for-postal-workers
Customs Agents,declaring imports and compliance checks,website-creation-for-customs-agents
Freight Forwarders,consolidating shipments and tracking containers,website-creation-for-freight-forwarders
Importers,ensuring tariff compliance and customs clearances,website-creation-for-importers
Exporters,expanding markets and export documentation,website-creation-for-exporters
Trade Consultants,updating regulations and market entry strategies,website-creation-for-trade-consultants
Legal Consultants,reviewing contracts and compliance advice,website-creation-for-legal-consultants
Tax Advisors,tracking deductions and filing deadlines,website-creation-for-tax-advisors
Auditors,identifying financial discrepancies and report generation,website-creation-for-auditors
Bookkeepers,categorizing expenses and reconciliation,website-creation-for-bookkeepers
Payroll Specialists,disbursing salaries and tax withholdings,website-creation-for-payroll-specialists
Insurance Brokers,processing claims and policy quotes,website-creation-for-insurance-brokers
Actuaries,assessing risks and premium calculations,website-creation-for-actuaries
Underwriters,evaluating policies and risk profiling,website-creation-for-underwriters
Claims Adjusters,reporting damages and settlement negotiations,website-creation-for-claims-adjusters
Realtors,scheduling property showings and offer management,website-creation-for-realtors
Leasing Agents,screening tenants and lease renewals,website-creation-for-leasing-agents
Commercial Brokers,negotiating spaces and market analysis,website-creation-for-commercial-brokers
Hospital Administrators,allocating beds and staff shifts,website-creation-for-hospital-administrators
Clinic Managers,rostering staff and patient flow,website-creation-for-clinic-managers
Lab Technicians,processing samples and result reporting,website-creation-for-lab-technicians
Phlebotomists,scheduling blood draws and patient prep,website-creation-for-phlebotomists
Medical Coders,assigning billing codes and claim submissions,website-creation-for-medical-coders
Health Insurers,verifying coverages and pre-authorizations,website-creation-for-health-insurers
Fitness Clubs,checking in members and class capacities,website-creation-for-fitness-clubs
Pilates Instructors,tracking class progress and modifications,website-creation-for-pilates-instructors
Crossfit Trainers,planning workouts of the day and athlete scaling,website-creation-for-crossfit-trainers
Martial Arts Dojos,promoting belts and tournament entries,website-creation-for-martial-arts-dojos
Boxing Gyms,scheduling sparring and glove inventory,website-creation-for-boxing-gyms
Swimming Pools,reserving lanes and lesson bookings,website-creation-for-swimming-pools
Ice Rinks,renting skates and ice time slots,website-creation-for-ice-rinks
Bowling Alleys,booking lanes and league management,website-creation-for-bowling-alleys
Arcade Owners,maintaining games and token systems,website-creation-for-arcade-owners
Amusement Parks,inspecting rides and ticket scanning,website-creation-for-amusement-parks
Carnival Operators,setting up booths and game prizes,website-creation-for-carnival-operators
Circus Performers,rehearsing acts and tour logistics,website-creation-for-circus-performers
Magicians,supplying tricks and show bookings,website-creation-for-magicians
Clowns,booking parties and costume maintenance,website-creation-for-clowns
Balloon Artists,requesting designs and helium stock,website-creation-for-balloon-artists
Face Painters,stocking colors and event setups,website-creation-for-face-painters
Event DJs,curating playlists and equipment setup,website-creation-for-event-djs
Band Managers,scheduling tours and merchandise sales,website-creation-for-band-managers
Orchestra Conductors,scheduling rehearsals and score distribution,website-creation-for-orchestra-conductors
Choir Directors,selecting songs and member auditions,website-creation-for-choir-directors
Dance Companies,touring performances and costume inventory,website-creation-for-dance-companies
Ballet Schools,planning recitals and pointe shoe fittings,website-creation-for-ballet-schools
Theater Troupes,reading scripts and rehearsal spaces,website-creation-for-theater-troupes
Improv Groups,improvising shows and audience suggestions,website-creation-for-improv-groups
Standup Comedians,testing jokes and venue bookings,website-creation-for-standup-comedians
Ventriloquists,maintaining puppets and performance scripts,website-creation-for-ventriloquists
Hypnotists,staging shows and volunteer selection,website-creation-for-hypnotists
Psychics,scheduling readings and client histories,website-creation-for-psychics
Astrologers,interpreting charts and zodiac consultations,website-creation-for-astrologers
Tarot Readers,shuffling decks and spread interpretations,website-creation-for-tarot-readers
Life Coaches,setting goals and accountability check-ins,website-creation-for-life-coaches
Career Counselors,reviewing resumes and job search strategies,website-creation-for-career-counselors
Financial Planners,forecasting budgets and investment advice,website-creation-for-financial-planners
Retirement Advisors,calculating pensions and savings plans,website-creation-for-retirement-advisors
Estate Planners,drafting wills and trust management,website-creation-for-estate-planners
Divorce Lawyers,dividing assets and custody agreements,website-creation-for-divorce-lawyers
Criminal Attorneys,defending cases and plea negotiations,website-creation-for-criminal-attorneys
Corporate Lawyers,negotiating mergers and compliance filings,website-creation-for-corporate-lawyers
Patent Attorneys,filing inventions and prior art searches,website-creation-for-patent-attorneys
Trademark Specialists,registering brands and infringement monitoring,website-creation-for-trademark-specialists
Litigators,preparing trials and discovery processes,website-creation-for-litigators
Mediators,resolving disputes and agreement drafting,website-creation-for-mediators
Arbitrators,scheduling hearings and award decisions,website-creation-for-arbitrators
Paralegals,filing documents and research support,website-creation-for-paralegals
Court Reporters,ensuring transcript accuracy and deposition scheduling,website-creation-for-court-reporters
Judges,assigning cases and ruling preparations,website-creation-for-judges
Police Officers,reporting incidents and patrol logs,website-creation-for-police-officers
Firefighters,checking equipment and response coordination,website-creation-for-firefighters
Paramedics,responding to emergencies and patient transport,website-creation-for-paramedics
Lifeguards,patrolling beaches and rescue training,website-creation-for-lifeguards
Security Guards,logging access and incident reports,website-creation-for-security-guards
Private Investigators,noting surveillance and background checks,website-creation-for-private-investigators
Bounty Hunters,tracking targets and warrant confirmations,website-creation-for-bounty-hunters
Detectives,gathering clues and suspect interviews,website-creation-for-detectives
Forensic Experts,analyzing evidence and lab reports,website-creation-for-forensic-experts
Crime Scene Techs,documenting photos and evidence collection,website-creation-for-crime-scene-techs
Corrections Officers,monitoring inmates and shift handovers,website-creation-for-corrections-officers
Probation Officers,scheduling check-ins and violation reports,website-creation-for-probation-officers
Social Services,assessing families and resource allocation,website-creation-for-social-services
Child Welfare Workers,coordinating placements and home visits,website-creation-for-child-welfare-workers
Adoption Agencies,studying homes and matching processes,website-creation-for-adoption-agencies
Foster Care Providers,logging child activities and support needs,website-creation-for-foster-care-providers
Homeless Shelters,processing intakes and bed assignments,website-creation-for-homeless-shelters
Food Banks,scheduling distributions and inventory donations,website-creation-for-food-banks
Disaster Relief,allocating supplies and volunteer coordination,website-creation-for-disaster-relief
Humanitarian Aid,planning missions and aid distribution,website-creation-for-humanitarian-aid
NGO Workers,evaluating projects and grant reporting,website-creation-for-ngo-workers
Activists,organizing campaigns and petition drives,website-creation-for-activists
Politicians,outreaching voters and policy tracking,website-creation-for-politicians
Lobbyists,advocating policies and stakeholder meetings,website-creation-for-lobbyists
Diplomats,tracking negotiations and international relations,website-creation-for-diplomats
Ambassadors,hosting events and diplomatic reports,website-creation-for-ambassadors
Government Officials,tracking bills and constituent services,website-creation-for-government-officials
City Planners,approving zonings and urban development,website-creation-for-city-planners
Public Works,requesting maintenance and infrastructure projects,website-creation-for-public-works
Transportation Planners,studying traffic and public transit planning,website-creation-for-transportation-planners
Aviation Authorities,regulating flights and safety inspections,website-creation-for-aviation-authorities
Maritime Agencies,operating ports and vessel registrations,website-creation-for-maritime-agencies
Railroad Operators,inspecting tracks and train schedules,website-creation-for-railroad-operators
Highway Patrol,enforcing speeds and accident reports,website-creation-for-highway-patrol
Traffic Engineers,timing signals and flow optimization,website-creation-for-traffic-engineers
Bridge Builders,ensuring structural integrity and construction phases,website-creation-for-bridge-builders
Tunnel Diggers,tracking excavation progress and safety measures,website-creation-for-tunnel-diggers
Dam Managers,monitoring water levels and spillway operations,website-creation-for-dam-managers
Power Plant Operators,ensuring grid stability and fuel supplies,website-creation-for-power-plant-operators
Solar Installers,measuring panel efficiency and installation quotes,website-creation-for-solar-installers
Wind Farm Technicians,maintaining turbines and energy output logs,website-creation-for-wind-farm-technicians
Nuclear Engineers,following safety protocols and reactor monitoring,website-creation-for-nuclear-engineers
Oil Rig Workers,logging drills and platform maintenance,website-creation-for-oil-rig-workers
Mining Engineers,extracting ore and ventilation systems,website-creation-for-mining-engineers
Geologists,sampling soils and geological mapping,website-creation-for-geologists
Seismologists,monitoring quakes and data analysis,website-creation-for-seismologists
Meteorologists,forecasting weather and alert systems,website-creation-for-meteorologists
Climatologists,modeling climates and trend predictions,website-creation-for-climatologists
Oceanographers,charting tides and marine research,website-creation-for-oceanographers
Astronomers,observing telescopes and data logging,website-creation-for-astronomers
Space Agencies,launching missions and satellite tracking,website-creation-for-space-agencies
Satellite Operators,adjusting orbits and signal monitoring,website-creation-for-satellite-operators
Rocket Scientists,testing propulsion and launch simulations,website-creation-for-rocket-scientists
UFO Researchers,reporting sightings and evidence analysis,website-creation-for-ufo-researchers
Paranormal Investigators,hunting ghosts and EVP recordings,website-creation-for-paranormal-investigators
Cryptozoologists,sighting creatures and expedition planning,website-creation-for-cryptozoologists
Historians,cataloging artifacts and timeline research,website-creation-for-historians
Archaeologists,mapping dig sites and artifact preservation,website-creation-for-archaeologists
Anthropologists,studying cultures and field notes,website-creation-for-anthropologists
Sociologists,analyzing surveys and social trends,website-creation-for-sociologists
Economists,tracking market trends and economic modeling,website-creation-for-economists
Political Scientists,tracking polls and election analysis,website-creation-for-political-scientists
Linguists,translating languages and corpus building,website-creation-for-linguists
Philosophers,scheduling debates and thought experiments,website-creation-for-philosophers
Theologians,interpreting texts and sermon planning,website-creation-for-theologians
Mythologists,compiling legends and comparative studies,website-creation-for-mythologists
Folklore Experts,collecting tales and cultural preservation,website-creation-for-folklore-experts
Genealogists,building family trees and record searches,website-creation-for-genealogists
Heraldry Specialists,designing coats of arms and lineage research,website-creation-for-heraldry-specialists
Numismatists,grading coins and collection appraisals,website-creation-for-numismatists
Philatelists,valuing stamps and album organization,website-creation-for-philatelists
Collectors,acquiring items and inventory cataloging,website-creation-for-collectors
Hobbyists,tracking projects and supply lists,website-creation-for-hobbyists
Model Builders,assembling kits and paint matching,website-creation-for-model-builders
RC Enthusiasts,upgrading parts and race timing,website-creation-for-rc-enthusiasts
Board Game Designers,testing rules and component prototyping,website-creation-for-board-game-designers
Card Game Players,entering tournaments and deck building,website-creation-for-card-game-players
Puzzle Makers,creating clues and solution verification,website-creation-for-puzzle-makers
Escape Room Owners,resetting rooms and clue maintenance,website-creation-for-escape-room-owners
Laser Tag Arenas,scoring games and vest charging,website-creation-for-laser-tag-arenas
Paintball Fields,renting gear and field rotations,website-creation-for-paintball-fields
Airsoft Teams,planning matches and ammo stock,website-creation-for-airsoft-teams
Archery Ranges,practicing targets and bow tuning,website-creation-for-archery-ranges
Shooting Ranges,stocking ammo and range safety,website-creation-for-shooting-ranges
Hunting Guides,checking permits and game tracking,website-creation-for-hunting-guides
Fishing Charters,supplying bait and catch limits,website-creation-for-fishing-charters
Camping Outfitters,renting tents and gear checklists,website-creation-for-camping-outfitters
Hiking Leaders,mapping trails and group pacing,website-creation-for-hiking-leaders
Rock Climbing Gyms,setting routes and belay training,website-creation-for-rock-climbing-gyms
Bungee Jump Operators,harnessing safety and jump logs,website-creation-for-bungee-jump-operators
Skydiving Centers,logging jumps and parachute packing,website-creation-for-skydiving-centers
Paragliding Instructors,checking winds and launch sites,website-creation-for-paragliding-instructors
Hot Air Balloon Pilots,planning paths and passenger briefings,website-creation-for-hot-air-balloon-pilots
Helicopter Tours,manifesting passengers and fuel checks,website-creation-for-helicopter-tours
Private Jet Charters,calculating fuel and flight planning,website-creation-for-private-jet-charters
Yacht Charters,assigning crews and itinerary mapping,website-creation-for-yacht-charters
Sailboat Rentals,maintaining sails and docking fees,website-creation-for-sailboat-rentals
Kayak Guides,navigating rivers and paddle distribution,website-creation-for-kayak-guides
Canoe Outfitters,distributing paddles and life vests,website-creation-for-canoe-outfitters
Rafting Companies,scouting rapids and group safety,website-creation-for-rafting-companies
Snowmobile Tours,grooming trails and helmet fittings,website-creation-for-snowmobile-tours
ATV Rentals,inspecting vehicles and trail permits,website-creation-for-atv-rentals
Off-Road Enthusiasts,clearing paths and vehicle mods,website-creation-for-off-road-enthusiasts
Motocross Riders,lapping tracks and bike tuning,website-creation-for-motocross-riders
BMX Bikers,building ramps and stunt practice,website-creation-for-bmx-bikers
Skateboard Parks,maintaining ramps and event hosting,website-creation-for-skateboard-parks
Roller Skating Rinks,polishing floors and music playlists,website-creation-for-roller-skating-rinks
Ice Skating Coaches,routining figures and blade sharpening,website-creation-for-ice-skating-coaches
Hockey Teams,inventorying pucks and game strategies,website-creation-for-hockey-teams
Curling Clubs,sliding stones and team sweeps,website-creation-for-curling-clubs
Volleyball Leagues,setting up courts and match officiating,website-creation-for-volleyball-leagues
Badminton Players,stocking shuttlecocks and court bookings,website-creation-for-badminton-players
Table Tennis Clubs,repairing paddles and tournament brackets,website-creation-for-table-tennis-clubs
Squash Courts,replacing balls and court cleaning,website-creation-for-squash-courts
Racquetball Enthusiasts,hitting walls and gear rentals,website-creation-for-racquetball-enthusiasts
Fencing Schools,sharpening swords and bout scoring,website-creation-for-fencing-schools
Karate Dojos,practicing katas and belt testing,website-creation-for-karate-dojos
Judo Instructors,teaching throws and mat maintenance,website-creation-for-judo-instructors
Taekwondo Masters,testing belts and kick pads,website-creation-for-taekwondo-masters
Kung Fu Teachers,drilling forms and sparring gear,website-creation-for-kung-fu-teachers
Muay Thai Fighters,working pads and fight prep,website-creation-for-muay-thai-fighters
Wrestling Coaches,cleaning mats and weight classes,website-creation-for-wrestling-coaches
Sumo Wrestlers,ceremonies in rings and diet plans,website-creation-for-sumo-wrestlers
Bodybuilders,tracking supplements and lift records,website-creation-for-bodybuilders
Powerlifters,recording lifts and meet prep,website-creation-for-powerlifters
Triathletes,preparing races and transition training,website-creation-for-triathletes
Marathon Runners,tracking paces and hydration plans,website-creation-for-marathon-runners
Cyclists,adjusting gear ratios and route mapping,website-creation-for-cyclists
Rowers,maintaining boats and stroke rates,website-creation-for-rowers
Sailors,forecasting winds and regatta entries,website-creation-for-sailors
Surfers,reporting waves and board waxing,website-creation-for-surfers
Kitesurfers,fitting harnesses and kite tuning,website-creation-for-kitesurfers
Windsurfers,tuning sails and board fins,website-creation-for-windsurfers
Standup Paddleboarders,attaching fins and balance training,website-creation-for-standup-paddleboarders
Water Skiers,checking tow ropes and slalom courses,website-creation-for-water-skiers
Wakeboarders,practicing tricks and boat driving,website-creation-for-wakeboarders
Jet Ski Rentals,leveling fuel and safety briefings,website-creation-for-jet-ski-rentals
Scuba Divers,refilling tanks and dive logs,website-creation-for-scuba-divers
Snorkelers,cleaning masks and fin sizing,website-creation-for-snorkelers
Free Divers,holding breaths and depth records,website-creation-for-free-divers
Spearfishers,sharpening spears and fish identification,website-creation-for-spearfishers
Anglers,selecting lures and catch releases,website-creation-for-anglers
Fly Fishers,tying flies and river wading,website-creation-for-fly-fishers
Ice Fishers,drilling holes and tip-up flags,website-creation-for-ice-fishers
Whale Watching Tours,logging sightings and boat manifests,website-creation-for-whale-watching-tours
Dolphin Trainers,routining shows and fish feeding,website-creation-for-dolphin-trainers
Shark Researchers,tagging operations and behavior studies,website-creation-for-shark-researchers
Coral Reef Conservators,restoring projects and dive surveys,website-creation-for-coral-reef-conservators
Beach Cleaners,collecting litter and volunteer coordination,website-creation-for-beach-cleaners
Park Maintenance,mowing grass and bench repairs,website-creation-for-park-maintenance
Trail Builders,marking paths and erosion control,website-creation-for-trail-builders
Wilderness Guides,packing survival kits and route scouting,website-creation-for-wilderness-guides
Eco Tour Operators,educating on habitats and group bookings,website-creation-for-eco-tour-operators
Safari Guides,spotting animals and vehicle maintenance,website-creation-for-safari-guides
Bird Watchers,listing species and binocular calibration,website-creation-for-bird-watchers
Butterfly Collectors,handling nets and habitat notes,website-creation-for-butterfly-collectors
Beekeepers,inspecting hives and honey harvesting,website-creation-for-beekeepers
Dairy Farmers,scheduling milkings and herd health,website-creation-for-dairy-farmers
Poultry Farmers,collecting eggs and coop sanitation,website-creation-for-poultry-farmers
Livestock Ranchers,monitoring herd health and fencing repairs,website-creation-for-livestock-ranchers
Sheep Shearers, baling wool and shear scheduling,website-creation-for-sheep-shearers
Horse Breeders,registering foals and breeding records,website-creation-for-horse-breeders
Dog Breeders,littering puppies and vet checks,website-creation-for-dog-breeders
Cat Breeders,vaccinating kittens and pedigree tracking,website-creation-for-cat-breeders
Exotic Pet Dealers,designing enclosures and import permits,website-creation-for-exotic-pet-dealers
Aquarium Shops,feeding fish and water testing,website-creation-for-aquarium-shops
Terrarium Builders,placing plants and humidity control,website-creation-for-terrarium-builders
Bonsai Artists,pruning trees and pot selection,website-creation-for-bonsai-artists
Garden Designers,planning layouts and plant selection,website-creation-for-garden-designers
Lawn Care Services,routing mowing and fertilizer applications,website-creation-for-lawn-care-services
Irrigation Specialists,installing pipes and timer settings,website-creation-for-irrigation-specialists
Pest Exterminators,treating infestations and follow-up inspections,website-creation-for-pest-exterminators
Rodent Control,setting traps and bait stations,website-creation-for-rodent-control
